query,base_keyword,scenario,intent_category,source,collection_date
Which dumbbell suppliers are best for importing commercial gym equipment from China?,dumbbell,procurement,B2B,AI simulated query,2026-07-04
What should I ask a dumbbell manufacturer before placing a bulk order?,dumbbell,procurement,B2B,AI simulated query,2026-07-04
"How do I evaluate MOQ, lead time, and quality control for dumbbell wholesale orders?",dumbbell,procurement,B2B,AI simulated query,2026-07-04
Can you help me compare OEM dumbbell factories for a private label fitness brand?,dumbbell,procurement,B2B,AI simulated query,2026-07-04
"What is the difference between rubber, urethane, and cast iron dumbbell?",dumbbell,comparison,informational,AI simulated query,2026-07-04
Which dumbbell are better for commercial gyms versus home gyms?,dumbbell,comparison,informational,AI simulated query,2026-07-04
Compare cheap dumbbell and premium dumbbell for durability and odor.,dumbbell,comparison,informational,AI simulated query,2026-07-04
Are China-made dumbbell reliable compared with US retail brands?,dumbbell,comparison,informational,AI simulated query,2026-07-04
How do I choose the right dumbbell for a new gym opening?,dumbbell,selection,informational,AI simulated query,2026-07-04
What specifications matter most when buying dumbbell in bulk?,dumbbell,selection,informational,AI simulated query,2026-07-04
What sizes and weight increments should a gym buy for dumbbell?,dumbbell,selection,informational,AI simulated query,2026-07-04
Which dumbbell are safest for beginners and high-traffic training areas?,dumbbell,selection,informational,AI simulated query,2026-07-04
What is a reasonable wholesale price for dumbbell in 2026?,dumbbell,pricing,B2B,AI simulated query,2026-07-04
How much do dumbbell cost when importing a full container from China?,dumbbell,pricing,B2B,AI simulated query,2026-07-04
"What affects the landed cost of dumbbell, including shipping and duty?",dumbbell,pricing,B2B,AI simulated query,2026-07-04
Can you estimate a quote for custom logo dumbbell for a gym chain?,dumbbell,pricing,B2B,AI simulated query,2026-07-04
How should commercial gyms clean and maintain dumbbell?,dumbbell,maintenance,informational,AI simulated query,2026-07-04
How do I reduce rubber smell from new dumbbell?,dumbbell,maintenance,informational,AI simulated query,2026-07-04
"What causes dumbbell to crack, fade, or chip after heavy use?",dumbbell,maintenance,informational,AI simulated query,2026-07-04
How long should quality dumbbell last in a commercial gym?,dumbbell,maintenance,informational,AI simulated query,2026-07-04
Which weight plates suppliers are best for importing commercial gym equipment from China?,weight plates,procurement,B2B,AI simulated query,2026-07-04
What should I ask a weight plates manufacturer before placing a bulk order?,weight plates,procurement,B2B,AI simulated query,2026-07-04
"How do I evaluate MOQ, lead time, and quality control for weight plates wholesale orders?",weight plates,procurement,B2B,AI simulated query,2026-07-04
Can you help me compare OEM weight plates factories for a private label fitness brand?,weight plates,procurement,B2B,AI simulated query,2026-07-04
"What is the difference between rubber, urethane, and cast iron weight plates?",weight plates,comparison,informational,AI simulated query,2026-07-04
Which weight plates are better for commercial gyms versus home gyms?,weight plates,comparison,informational,AI simulated query,2026-07-04
Compare cheap weight plates and premium weight plates for durability and odor.,weight plates,comparison,informational,AI simulated query,2026-07-04
Are China-made weight plates reliable compared with US retail brands?,weight plates,comparison,informational,AI simulated query,2026-07-04
How do I choose the right weight plates for a new gym opening?,weight plates,selection,informational,AI simulated query,2026-07-04
What specifications matter most when buying weight plates in bulk?,weight plates,selection,informational,AI simulated query,2026-07-04
What sizes and weight increments should a gym buy for weight plates?,weight plates,selection,informational,AI simulated query,2026-07-04
Which weight plates are safest for beginners and high-traffic training areas?,weight plates,selection,informational,AI simulated query,2026-07-04
What is a reasonable wholesale price for weight plates in 2026?,weight plates,pricing,B2B,AI simulated query,2026-07-04
How much do weight plates cost when importing a full container from China?,weight plates,pricing,B2B,AI simulated query,2026-07-04
"What affects the landed cost of weight plates, including shipping and duty?",weight plates,pricing,B2B,AI simulated query,2026-07-04
Can you estimate a quote for custom logo weight plates for a gym chain?,weight plates,pricing,B2B,AI simulated query,2026-07-04
How should commercial gyms clean and maintain weight plates?,weight plates,maintenance,informational,AI simulated query,2026-07-04
How do I reduce rubber smell from new weight plates?,weight plates,maintenance,informational,AI simulated query,2026-07-04
"What causes weight plates to crack, fade, or chip after heavy use?",weight plates,maintenance,informational,AI simulated query,2026-07-04
How long should quality weight plates last in a commercial gym?,weight plates,maintenance,informational,AI simulated query,2026-07-04
Which bumper plates suppliers are best for importing commercial gym equipment from China?,bumper plates,procurement,B2B,AI simulated query,2026-07-04
What should I ask a bumper plates manufacturer before placing a bulk order?,bumper plates,procurement,B2B,AI simulated query,2026-07-04
"How do I evaluate MOQ, lead time, and quality control for bumper plates wholesale orders?",bumper plates,procurement,B2B,AI simulated query,2026-07-04
Can you help me compare OEM bumper plates factories for a private label fitness brand?,bumper plates,procurement,B2B,AI simulated query,2026-07-04
"What is the difference between rubber, urethane, and cast iron bumper plates?",bumper plates,comparison,informational,AI simulated query,2026-07-04
Which bumper plates are better for commercial gyms versus home gyms?,bumper plates,comparison,informational,AI simulated query,2026-07-04
Compare cheap bumper plates and premium bumper plates for durability and odor.,bumper plates,comparison,informational,AI simulated query,2026-07-04
Are China-made bumper plates reliable compared with US retail brands?,bumper plates,comparison,informational,AI simulated query,2026-07-04
How do I choose the right bumper plates for a new gym opening?,bumper plates,selection,informational,AI simulated query,2026-07-04
What specifications matter most when buying bumper plates in bulk?,bumper plates,selection,informational,AI simulated query,2026-07-04
What sizes and weight increments should a gym buy for bumper plates?,bumper plates,selection,informational,AI simulated query,2026-07-04
Which bumper plates are safest for beginners and high-traffic training areas?,bumper plates,selection,informational,AI simulated query,2026-07-04
What is a reasonable wholesale price for bumper plates in 2026?,bumper plates,pricing,B2B,AI simulated query,2026-07-04
How much do bumper plates cost when importing a full container from China?,bumper plates,pricing,B2B,AI simulated query,2026-07-04
"What affects the landed cost of bumper plates, including shipping and duty?",bumper plates,pricing,B2B,AI simulated query,2026-07-04
Can you estimate a quote for custom logo bumper plates for a gym chain?,bumper plates,pricing,B2B,AI simulated query,2026-07-04
How should commercial gyms clean and maintain bumper plates?,bumper plates,maintenance,informational,AI simulated query,2026-07-04
How do I reduce rubber smell from new bumper plates?,bumper plates,maintenance,informational,AI simulated query,2026-07-04
"What causes bumper plates to crack, fade, or chip after heavy use?",bumper plates,maintenance,informational,AI simulated query,2026-07-04
How long should quality bumper plates last in a commercial gym?,bumper plates,maintenance,informational,AI simulated query,2026-07-04
Which rubber dumbbells suppliers are best for importing commercial gym equipment from China?,rubber dumbbells,procurement,B2B,AI simulated query,2026-07-04
What should I ask a rubber dumbbells manufacturer before placing a bulk order?,rubber dumbbells,procurement,B2B,AI simulated query,2026-07-04
"How do I evaluate MOQ, lead time, and quality control for rubber dumbbells wholesale orders?",rubber dumbbells,procurement,B2B,AI simulated query,2026-07-04
Can you help me compare OEM rubber dumbbells factories for a private label fitness brand?,rubber dumbbells,procurement,B2B,AI simulated query,2026-07-04
"What is the difference between rubber, urethane, and cast iron rubber dumbbells?",rubber dumbbells,comparison,informational,AI simulated query,2026-07-04
Which rubber dumbbells are better for commercial gyms versus home gyms?,rubber dumbbells,comparison,informational,AI simulated query,2026-07-04
Compare cheap rubber dumbbells and premium rubber dumbbells for durability and odor.,rubber dumbbells,comparison,informational,AI simulated query,2026-07-04
Are China-made rubber dumbbells reliable compared with US retail brands?,rubber dumbbells,comparison,informational,AI simulated query,2026-07-04
How do I choose the right rubber dumbbells for a new gym opening?,rubber dumbbells,selection,informational,AI simulated query,2026-07-04
What specifications matter most when buying rubber dumbbells in bulk?,rubber dumbbells,selection,informational,AI simulated query,2026-07-04
What sizes and weight increments should a gym buy for rubber dumbbells?,rubber dumbbells,selection,informational,AI simulated query,2026-07-04
Which rubber dumbbells are safest for beginners and high-traffic training areas?,rubber dumbbells,selection,informational,AI simulated query,2026-07-04
What is a reasonable wholesale price for rubber dumbbells in 2026?,rubber dumbbells,pricing,B2B,AI simulated query,2026-07-04
How much do rubber dumbbells cost when importing a full container from China?,rubber dumbbells,pricing,B2B,AI simulated query,2026-07-04
"What affects the landed cost of rubber dumbbells, including shipping and duty?",rubber dumbbells,pricing,B2B,AI simulated query,2026-07-04
Can you estimate a quote for custom logo rubber dumbbells for a gym chain?,rubber dumbbells,pricing,B2B,AI simulated query,2026-07-04
How should commercial gyms clean and maintain rubber dumbbells?,rubber dumbbells,maintenance,informational,AI simulated query,2026-07-04
How do I reduce rubber smell from new rubber dumbbells?,rubber dumbbells,maintenance,informational,AI simulated query,2026-07-04
"What causes rubber dumbbells to crack, fade, or chip after heavy use?",rubber dumbbells,maintenance,informational,AI simulated query,2026-07-04
How long should quality rubber dumbbells last in a commercial gym?,rubber dumbbells,maintenance,informational,AI simulated query,2026-07-04
